{
  "schema_version": "1.0.0",
  "input": {
    "calendar": "gregorian",
    "birth_datetime": "2001-02-04T04:45:00-05:00",
    "timezone": "America/New_York",
    "gender": "unknown",
    "location": {
      "country": "US",
      "region": "New York",
      "city": "New York",
      "longitude": -74.006,
      "latitude": 40.7128
    },
    "use_true_solar_time": true
  },
  "chart": {
    "year": {
      "stem": {
        "char": "辛",
        "element": "metal",
        "yin_yang": "yin"
      },
      "branch": {
        "char": "巳",
        "element": "fire",
        "yin_yang": "yin",
        "hidden_stems": [
          {
            "stem": {
              "char": "丙",
              "element": "fire",
              "yin_yang": "yang"
            },
            "qi_type": "main",
            "weight": 0.6
          },
          {
            "stem": {
              "char": "戊",
              "element": "earth",
              "yin_yang": "yang"
            },
            "qi_type": "middle",
            "weight": 0.3
          },
          {
            "stem": {
              "char": "庚",
              "element": "metal",
              "yin_yang": "yang"
            },
            "qi_type": "residual",
            "weight": 0.1
          }
        ]
      }
    },
    "month": {
      "stem": {
        "char": "庚",
        "element": "metal",
        "yin_yang": "yang"
      },
      "branch": {
        "char": "寅",
        "element": "wood",
        "yin_yang": "yang",
        "hidden_stems": [
          {
            "stem": {
              "char": "甲",
              "element": "wood",
              "yin_yang": "yang"
            },
            "qi_type": "main",
            "weight": 0.6
          },
          {
            "stem": {
              "char": "丙",
              "element": "fire",
              "yin_yang": "yang"
            },
            "qi_type": "middle",
            "weight": 0.3
          },
          {
            "stem": {
              "char": "戊",
              "element": "earth",
              "yin_yang": "yang"
            },
            "qi_type": "residual",
            "weight": 0.1
          }
        ]
      }
    },
    "day": {
      "stem": {
        "char": "戊",
        "element": "earth",
        "yin_yang": "yang"
      },
      "branch": {
        "char": "戌",
        "element": "earth",
        "yin_yang": "yang",
        "hidden_stems": [
          {
            "stem": {
              "char": "戊",
              "element": "earth",
              "yin_yang": "yang"
            },
            "qi_type": "main",
            "weight": 0.6
          },
          {
            "stem": {
              "char": "辛",
              "element": "metal",
              "yin_yang": "yin"
            },
            "qi_type": "middle",
            "weight": 0.3
          },
          {
            "stem": {
              "char": "丁",
              "element": "fire",
              "yin_yang": "yin"
            },
            "qi_type": "residual",
            "weight": 0.1
          }
        ]
      }
    },
    "hour": {
      "stem": {
        "char": "甲",
        "element": "wood",
        "yin_yang": "yang"
      },
      "branch": {
        "char": "寅",
        "element": "wood",
        "yin_yang": "yang",
        "hidden_stems": [
          {
            "stem": {
              "char": "甲",
              "element": "wood",
              "yin_yang": "yang"
            },
            "qi_type": "main",
            "weight": 0.6
          },
          {
            "stem": {
              "char": "丙",
              "element": "fire",
              "yin_yang": "yang"
            },
            "qi_type": "middle",
            "weight": 0.3
          },
          {
            "stem": {
              "char": "戊",
              "element": "earth",
              "yin_yang": "yang"
            },
            "qi_type": "residual",
            "weight": 0.1
          }
        ]
      }
    },
    "day_master": {
      "char": "戊",
      "element": "earth",
      "yin_yang": "yang"
    }
  },
  "elements": {
    "wood": {
      "raw": 1.6,
      "adjusted": 2.0,
      "confidence": 0.72,
      "evidence_ids": [
        "month.branch.寅.hidden.甲.main",
        "hour.stem.甲",
        "hour.branch.寅.hidden.甲.main",
        "elements.wood.season_adjustment"
      ]
    },
    "fire": {
      "raw": 0.65,
      "adjusted": 0.715,
      "confidence": 0.72,
      "evidence_ids": [
        "year.branch.巳.hidden.丙.main",
        "month.branch.寅.hidden.丙.middle",
        "day.branch.戌.hidden.丁.residual",
        "hour.branch.寅.hidden.丙.middle",
        "elements.fire.season_adjustment"
      ]
    },
    "earth": {
      "raw": 1.55,
      "adjusted": 1.3175,
      "confidence": 0.72,
      "evidence_ids": [
        "year.branch.巳.hidden.戊.middle",
        "month.branch.寅.hidden.戊.residual",
        "day.stem.戊",
        "day.branch.戌.hidden.戊.main",
        "hour.branch.寅.hidden.戊.residual",
        "elements.earth.season_adjustment"
      ]
    },
    "metal": {
      "raw": 2.2,
      "adjusted": 2.2,
      "confidence": 0.72,
      "evidence_ids": [
        "year.stem.辛",
        "year.branch.巳.hidden.庚.residual",
        "month.stem.庚",
        "day.branch.戌.hidden.辛.middle",
        "elements.metal.season_adjustment"
      ]
    },
    "water": {
      "raw": 0.0,
      "adjusted": 0.0,
      "confidence": 0.72,
      "evidence_ids": [
        "elements.water.season_adjustment"
      ]
    }
  },
  "ten_gods": {
    "peer": {
      "raw": 0.55,
      "adjusted": 0.55,
      "confidence": 0.78,
      "evidence_ids": [
        "year.branch.巳.hidden.戊.middle",
        "month.branch.寅.hidden.戊.residual",
        "day.branch.戌.hidden.戊.main",
        "hour.branch.寅.hidden.戊.residual"
      ]
    },
    "rob_wealth": {
      "raw": 0.0,
      "adjusted": 0.0,
      "confidence": 1.0,
      "evidence_ids": []
    },
    "eating_god": {
      "raw": 1.05,
      "adjusted": 1.05,
      "confidence": 0.78,
      "evidence_ids": [
        "year.branch.巳.hidden.庚.residual",
        "month.stem.庚"
      ]
    },
    "hurting_officer": {
      "raw": 1.15,
      "adjusted": 1.15,
      "confidence": 0.78,
      "evidence_ids": [
        "year.stem.辛",
        "day.branch.戌.hidden.辛.middle"
      ]
    },
    "direct_wealth": {
      "raw": 0.0,
      "adjusted": 0.0,
      "confidence": 1.0,
      "evidence_ids": []
    },
    "indirect_wealth": {
      "raw": 0.0,
      "adjusted": 0.0,
      "confidence": 1.0,
      "evidence_ids": []
    },
    "direct_officer": {
      "raw": 0.0,
      "adjusted": 0.0,
      "confidence": 1.0,
      "evidence_ids": []
    },
    "seven_killings": {
      "raw": 1.6,
      "adjusted": 1.6,
      "confidence": 0.78,
      "evidence_ids": [
        "month.branch.寅.hidden.甲.main",
        "hour.stem.甲",
        "hour.branch.寅.hidden.甲.main"
      ]
    },
    "direct_resource": {
      "raw": 0.05,
      "adjusted": 0.05,
      "confidence": 0.78,
      "evidence_ids": [
        "day.branch.戌.hidden.丁.residual"
      ]
    },
    "indirect_resource": {
      "raw": 0.6,
      "adjusted": 0.6,
      "confidence": 0.78,
      "evidence_ids": [
        "year.branch.巳.hidden.丙.main",
        "month.branch.寅.hidden.丙.middle",
        "hour.branch.寅.hidden.丙.middle"
      ]
    }
  },
  "luck_cycles": [
    {
      "index": 1,
      "start_age": 9.89,
      "end_age": 19.89,
      "start_year": 2010,
      "end_year": 2019,
      "pillar": {
        "stem": {
          "char": "辛",
          "element": "metal",
          "yin_yang": "yin"
        },
        "branch": {
          "char": "卯",
          "element": "wood",
          "yin_yang": "yin",
          "hidden_stems": [
            {
              "stem": {
                "char": "乙",
                "element": "wood",
                "yin_yang": "yin"
              },
              "qi_type": "main",
              "weight": 1.0
            }
          ]
        }
      },
      "evidence_ids": [
        "luck_cycle.1.calculation"
      ]
    },
    {
      "index": 2,
      "start_age": 19.89,
      "end_age": 29.89,
      "start_year": 2020,
      "end_year": 2029,
      "pillar": {
        "stem": {
          "char": "壬",
          "element": "water",
          "yin_yang": "yang"
        },
        "branch": {
          "char": "辰",
          "element": "earth",
          "yin_yang": "yang",
          "hidden_stems": [
            {
              "stem": {
                "char": "戊",
                "element": "earth",
                "yin_yang": "yang"
              },
              "qi_type": "main",
              "weight": 0.6
            },
            {
              "stem": {
                "char": "乙",
                "element": "wood",
                "yin_yang": "yin"
              },
              "qi_type": "middle",
              "weight": 0.3
            },
            {
              "stem": {
                "char": "癸",
                "element": "water",
                "yin_yang": "yin"
              },
              "qi_type": "residual",
              "weight": 0.1
            }
          ]
        }
      },
      "evidence_ids": [
        "luck_cycle.2.calculation"
      ]
    },
    {
      "index": 3,
      "start_age": 29.89,
      "end_age": 39.89,
      "start_year": 2030,
      "end_year": 2039,
      "pillar": {
        "stem": {
          "char": "癸",
          "element": "water",
          "yin_yang": "yin"
        },
        "branch": {